{
  "activeSlotsCoeff": 0.05,
  "epochLength": 432000,
  "genDelegs": {},
  "initialFunds": {},
  "maxKESEvolutions": 60,
  "maxLovelaceSupply": 2010000000000000,
  "networkId": "Testnet",
  "networkMagic": 42,
  "protocolParams": {
    "a0": 0.3,
    "decentralisationParam": 0,
    "eMax": 18,
    "extraEntropy": {
      "tag": "NeutralNonce"
    },
    "keyDeposit": 400000,
    "maxBlockBodySize": 81920,
    "maxBlockHeaderSize": 1100,
    "maxTxSize": 16384,
    "minFeeA": 0,
    "minFeeB": 0,
    "minPoolCost": 0,
    "minUTxOValue": 0,
    "nOpt": 50,
    "poolDeposit": 500000000,
    "protocolVersion": {
      "major": 5,
      "minor": 0
    },
    "rho": 0.0022,
    "tau": 0.05
  },
  "securityParam": 2160,
  "slotLength": 1,
  "slotsPerKESPeriod": 129600,
  "staking": {
    "pools": {},
    "stake": {}
  },
  "systemStart": "2022-06-16T08:04:19Z",
  "updateQuorum": 5,
  "extraConfig": {
    "initialFunds": {
      "file": [
        "initial-funds.json"
      ],
      "hash": "9287594e73fc376587fa38beda535a2b3d782a637961e8edf5f131c7afc4be5d"
    },
    "stakePools": {
      "file": [
        "stake-pools.json"
      ],
      "hash": "15be7bab8f331b6a6b551583508e7ffc2dc36e3a47cbdac19b55a245162c23f1"
    }
  }
}
